Title Number,Title Name
Title 1,C++ Program for GCD of more than two (or array) numbers
Title 2,Tips on How to Write a Research Paper
Title 3,Future of Web Development
Title 4,What is the future of jobs in Software Engineering industry?
Title 5,Java program to convert First Character Uppercase in a Sentence
Title 6,Mistakes to Avoid while Learning Data Science
Title 7,Web Developers vs Website Builders
Title 8,Javascript program to check if a given number is Ugly Number or not
Title 9,Is Coding for Non-Tech person?
Title 10,A Day in my Life at IIT KHARAGPUR
Title 11,Validating traditional time formats using Regular Expression
Title 12,Determine whether the given Array forms a valley or not
Title 13,10 Best Ethical Hacking Books
Title 14,9 Common Interview Questions & Answers For Freshers (2023)
Title 15,Count non-overlapping Subarrays of size K with equal alternate elements
Title 16,Redemption of Debentures
Title 17,Accounting Treatment of Investment Fluctuation Fund in case of Death of a Partner
Title 18,Why does the C++ STL not provide any “tree” containers?
Title 19,How can I modify an element of a PriorityQueue in Java?
Title 20,Scope of e-Business: B2B Commerce| B2C Commerce|C2C Commerce|Intra B-Commerce
Title 21,Maximize profit by picking elements of different types with total weight K
Title 22,Check if Array elements in given range form Permutation by performing given updates
Title 23,What is the difference between Hashing and Hash Tables?
Title 24,Count of factors of length K in the number itself
Title 25,10 Best Books for Database Administrators and Developers
Title 26,Interview Preparation Package
Title 27,Data Structures & Algorithms- Self Paced Course
Title 28,Complete Data Science Program
